{
  "schemaVersion": 1,
  "id": "sd15-baseline",
  "version": "0.2.0",
  "displayName": "Stable Diffusion 1.5",
  "status": "experimental",
  "source": {
    "provider": "huggingface",
    "repoId": "stable-diffusion-v1-5/stable-diffusion-v1-5",
    "revision": "451f4fe16113bff5a5d2269ed5ad43b0592e9a14"
  },
  "adapterId": "diffusers.sd15",
  "runtimeProfileId": "sd15-cu126-v1",
  "operations": ["generate.image"],
  "minimumVramMiB": 6144,
  "notes": [
    "Windows x64, NVIDIA CUDA, at least 6 GB VRAM. Each installation must pass local inference verification.",
    "512x512; precision and offloading are chosen from the GPU and verified per machine, with float32 and model CPU offload as the fallback; selected fp16 safetensors stored on disk.",
    "Model license: CreativeML Open RAIL-M; see the pinned model card and linked license before use.",
    "Experimental recipe; readiness is granted per machine only after checksums and real GPU output checks succeed."
  ]
}
